{
  "$schema": "https://json-schema.org/draft/2020-12/schema",
  "$id": "https://condominio-auditoria/contracts/mensagens/v3/index-file.schema.json",
  "title": "IndexFile v3",
  "description": "v3 (ADR 0006, fase 2): igual à versão anterior, com nomes e códigos em inglês. api → rag (fila rag.indexing). INDEX: o rag lê o original pelo caminho, corta em trechos por localização (página; aba e linhas; seção e parágrafos) e grava trechos e vetores no schema rag. WITHDRAW: exclusão lógica ou versão substituída; o rag marca o índice do arquivo como retirado, sem apagar. O conteúdo não vai na mensagem. Publicada depois do commit (ADR 0002). Idempotência (ADR 0003, Decisão 5.1): mesmo arquivo, sha256, modelo de embeddings e versão do indexador = o rag só confirma INDEXED sem refazer.",
  "type": "object",
  "required": [
    "version",
    "operation",
    "indexingId",
    "fileId",
    "condominiumId",
    "category",
    "originalName",
    "path",
    "sha256"
  ],
  "additionalProperties": false,
  "properties": {
    "version": {"const": 3},
    "operation": {"enum": ["INDEX", "WITHDRAW"]},
    "indexingId": {
      "type": "string",
      "format": "uuid",
      "description": "Muda a cada pedido (envio, reprocesso, nova versão, reindexar, retirar). Resultado com outro indexingId é descartado pelo api."
    },
    "fileId": {"type": "string", "format": "uuid"},
    "condominiumId": {"type": "string", "format": "uuid"},
    "category": {
      "type": "string",
      "description": "Categoria do arquivo no api (TRIAL_BALANCE, BANK_STATEMENT, PO, CONTRACT, PAYROLL, RECEIPT, MINUTES, BYLAWS, OTHER). Texto, como em FileReceived, para categoria nova não quebrar o contrato."
    },
    "originalName": {"type": "string"},
    "path": {"type": "string", "description": "Caminho relativo dentro do armazenamento"},
    "sha256": {"type": "string", "pattern": "^[0-9a-f]{64}$"},
    "periodStart": {
      "type": ["string", "null"],
      "format": "date",
      "pattern": "^[0-9]{4}-[0-9]{2}-[0-9]{2}$",
      "description": "Opcional: início do período a que o documento se refere. Usado no filtro por data da busca."
    },
    "periodEnd": {
      "type": ["string", "null"],
      "format": "date",
      "pattern": "^[0-9]{4}-[0-9]{2}-[0-9]{2}$",
      "description": "Opcional: fim do período a que o documento se refere."
    },
    "fileVersion": {
      "type": ["integer", "null"],
      "minimum": 1,
      "description": "Opcional: versão do arquivo (1, 2, ...). Só a versão vigente aparece na busca."
    },
    "embeddingMode": {
      "enum": ["LOCAL", "OFF", null],
      "description": "Opcional, reservado para a entrega 2 (configuração de IA por condomínio). Ausente ou nulo = LOCAL. OFF = só trechos para a busca por palavra, sem vetores."
    },
    "embeddingModel": {
      "type": ["string", "null"],
      "description": "Opcional, reservado para a entrega 2. Ausente ou nulo = modelo padrão do rag (bge-m3, 1024 dimensões)."
    }
  }
}
